{"version":1,"packetId":"app/lib/observability/browser.ts::packet::BrowserObservabilityReporter.#releaseDeduplicationMarker","packetFingerprint":"c2264470ed94f4aadf333854a38d84ed6d1107ac754b88fa587f4f162f0da7e3","author":"implementation-agent","reviewer":"independent-codex-review","method":"codex-read-only","verdict":"approved","findings":[],"verification":["Read quality/semantic-review-contract.md and the exact packet JSON .quality/semantic-review/packets/1e80cbcb31f1068f2d0ff9703e6995b7400e81c22421270efcdc44b740655d94.json.","Inspected owned unit app/lib/observability/browser.ts lines 525-529 in context with BrowserObservabilityReporter queue, seen-map, enqueue, requeue, delivery, and exit-drain logic.","Inspected direct import app/lib/observability/events.ts and direct caller app/plugins/observability.client.ts.","Inspected relevant tests in test/unit/observability-browser.spec.ts, including queue eviction, newer generation preservation, active requeue truncation, and retry/exit-drain behavior around deduplication marker release.","Used read-only commands only; did not modify repository state."]}