{"version":1,"packetId":"app/pages/författare/[author]/[document]/[article].vue::packet::template-1","packetFingerprint":"f946582c5c2d0a7b4b4c0e052dd125fd2f8f3d05f40c8d100d4c3d9325343053","author":"implementation-agent","reviewer":"independent-codex-review","method":"codex-read-only","verdict":"approved","findings":[],"verification":["Read quality/semantic-review-contract.md and the single packet JSON only: .quality/semantic-review/packets/422ce0c9849e3a6ec723ec143085e047f1478dc71518035d251dc9172c4fa4da.json.","Inspected owned physical lines 181-232 in app/pages/författare/[author]/[document]/[article].vue plus surrounding script state that feeds the template.","Inspected direct import app/lib/internal-navigation.ts and direct dependencies app/composables/useManagedHtmlNavigation.ts, app/lib/managed-html-navigation.ts, app/components/global/RenderableHtmlContent.vue, shared/types/sla-article.ts, shared/types/renderable-html.ts, shared/utils/renderable-html.ts, server/api/author-documents/[author]/[document]/[article].get.ts, and server/utils/sla-article.ts.","Inspected adjacent route pattern app/pages/författare/[author]/[document]/index.vue for local implementation consistency.","Inspected relevant tests found by search: test/e2e/sla-articles.behavior.spec.ts, test/ssr/sla-articles.spec.ts, test/e2e/author-document-navigation.behavior.spec.ts, test/unit/managed-html-navigation.spec.ts, test/unit/internal-navigation.spec.ts, and test/nuxt/renderable-html-contract.ts.","No tests were executed because the review request constrained work to read-only commands."]}