{"version":1,"packetId":"app/lib/text-search.ts::packet::acceptTextSearchCountResponse","packetFingerprint":"3d017efe770b6843f8e5dbdcc0031c75b5bac1a79388d4463d5b597d22560baa","author":"implementation-agent","reviewer":"independent-codex-review","method":"codex-read-only","verdict":"approved","findings":[],"verification":["Read quality/semantic-review-contract.md and exactly the specified packet JSON.","Inspected owned unit app/lib/text-search.ts lines 640-648 plus adjacent response guard, request builders, identity helpers, and primitive validators.","Inspected direct caller app/pages/sök.vue count-loading flow and display consumption around lines 450-490 and 1575-1593.","Inspected generated API type boundary app/lib/api/generated/lbapi.ts TextSearchCountRequest/TextSearchCountResponse and /text-search/count operation schema.","Inspected relevant tests test/unit/text-search.spec.ts count acceptance/rejection coverage and test/ssr/text-search.spec.ts/test/e2e text-search count behavior references.","Used read-only commands only; tests were not executed because the review request constrained the work to read-only inspection."]}