{"version":1,"packetId":"server/utils/reader-source.ts::packet::buildFacsimileSources","packetFingerprint":"d96886caba7348e8b235c14decbdad706f38c93bd4ec7589760659c6597b38db","author":"implementation-agent","reviewer":"independent-codex-review","method":"codex-read-only","verdict":"approved","findings":[],"verification":["Read quality/semantic-review-contract.md.","Read exactly the specified packet JSON at .quality/semantic-review/packets/5eb7b02f3f759b7ff1c29ab8be2f0f2ad675185342b5746996c55b92be26409f.json.","Inspected owned source server/utils/reader-source.ts lines 236-248, plus direct helper facsimileImageUrl and surrounding metadata construction in the same file.","Inspected direct caller server/api/reader/[author]/[title]/[page]/[mediatype].get.ts where facsimile Reader API responses receive buildFacsimileSources output.","Inspected direct type boundaries shared/types/reader.ts, shared/types/work-manifest.ts, and generated app/lib/api/generated/lbapi.ts for ReaderFacsimileSource, FacsimileSize, ReaderFacsimileManifest, and WorkManifestFacsimilePage.","Inspected runtime manifest validation in server/utils/work-manifest-client.ts and server/utils/work-manifest-validation.ts; facsimile sizes are validated as non-empty, unique, finite positive widths and preferred_size must be present in sizes before reaching the owned unit.","Inspected consumer behavior in app/components/reader/ReaderFacsimileImage.vue and shared/utils/facsimile-source.ts for selected, retina, smaller, and larger facsimile source handling.","Inspected packet-named tests in test/unit/reader-source.spec.ts covering encoded facsimile image URLs, sorted sources, and N to N+2 pairing.","Ran read-only searches for buildFacsimileSources, facsimileImageUrl, ReaderFacsimileSource, and sources call sites; no additional direct callers of buildFacsimileSources were found.","Ran read-only git diff over reviewed source, dependencies, caller, consumer, and packet-named test; no local diff was present for those files.","Used read-only inspection commands only; no tests were executed because the review request constrained commands to read-only inspection."]}