{"version":1,"packetId":"server/utils/work-manifest-validation.ts::packet::module-passes","packetFingerprint":"75dbc89a5bed319a5f3395c811024440a6cc3769616f7c80a9d3c02b9a71be60","author":"implementation-agent","reviewer":"independent-codex-review","method":"codex-read-only","verdict":"approved","findings":[{"id":"server/utils/work-manifest-validation.ts::packet::module-passes::finding::urn-text-boundary","severity":"minor","category":"consistency","path":"server/utils/work-manifest-validation.ts","unitId":"server/utils/work-manifest-validation.ts::function::optionalUrn","line":110,"summary":"URN validation uses the raw string length helper instead of the manifest text-safety boundary.","consequence":"A 200 Reader manifest with a non-null URN containing C0/C1 controls, lone surrogates, or surrounding whitespace can pass the server manifest validator and be preserved as `ReaderManifestResponse`; the later production shortcut defensively drops those values, so the page can load with backend data that only fails when the user tries to copy the resolver URL.","evidence":"`optionalUrn` accepts `value === null || stringWithin(value, 100)`, while `manifestText` rejects untrimmed strings, C0/C1 controls, and lone surrogates. The validated `manifest.urn` is copied through `readerCommonMetadata` and the reader API response, then `urnResolverUrl` performs a second stricter check before building the resolver URL.","recommendation":"Validate URNs with `value === null || manifestText(value, 100)` and, if product semantics require real URNs, add the expected `urn:` shape there. That keeps the backend response boundary aligned with the later resolver URL boundary instead of accepting data that downstream code must discard.","status":"unresolved","resolution":null,"resolutionCommit":null,"verification":["Inspected owned source server/utils/work-manifest-validation.ts lines 70-111 and 321-337.","Inspected direct caller server/utils/work-manifest-client.ts lines 73-108.","Inspected downstream preservation through server/utils/reader-source.ts lines 292-317 and server/api/reader/[author]/[title]/[page]/[mediatype].get.ts lines 100-121.","Inspected resolver use in app/lib/production-shortcuts.ts lines 106-122 and reader page use at app/pages/författare/[author]/titlar/[title]/sida/[page]/[mediatype].vue line 1936.","Inspected relevant tests in test/unit/work-manifest-client.spec.ts and test/unit/production-shortcuts.spec.ts."]}],"verification":["Read review contract quality/semantic-review-contract.md.","Read exactly packet .quality/semantic-review/packets/d8291676e1e6f5b10e473f32c91a237fa14125c26fedca58ee2cff1cefa66476.json.","Inspected current owned source server/utils/work-manifest-validation.ts, including all packet-owned physical line ranges.","Inspected listed imports: server/utils/reader-source-info-validation.ts, shared/types/reader.ts, shared/types/work-manifest.ts, and shared/utils/text-safety.ts.","Inspected direct caller server/utils/work-manifest-client.ts and downstream consumers server/utils/reader-source.ts and server/api/reader/[author]/[title]/[page]/[mediatype].get.ts.","Inspected generated OpenAPI type boundary app/lib/api/generated/lbapi.ts for Reader and Editor manifest schemas.","Inspected relevant tests discovered for this area: test/unit/work-manifest-client.spec.ts, test/nuxt/reader-editor-manifest-contract.ts, and test/unit/production-shortcuts.spec.ts.","Used read-only commands only; no tests were executed because the request constrained the review to read-only inspection."]}