{"version":1,"packetId":"app/lib/production-shortcuts.ts::packet::encodedUrnResolverUrl","packetFingerprint":"331bb9506094b29c3206af2370da888e81201f50f5c5fd22221b7db1d71e62a8","author":"codex-root","reviewer":"independent-codex-review","method":"codex-read-only","verdict":"approved","findings":[],"verification":["Read quality/semantic-review-contract.md.","Read exactly packet .quality/semantic-review/packets/b8b42bb8ed2eb2669a77b2251954b2256f80d1171a6fe5f58c7442961665836b.json.","Inspected owned unit app/lib/production-shortcuts.ts lines 146-150 plus surrounding validUrn validation and urnResolverUrl delegation.","Inspected listed import app/lib/library-navigation.ts.","Inspected listed direct callers app/components/author/AuthorProfileContent.vue, app/components/global/SiteShell.vue, app/components/reader/ReaderSourceInfoDialog.vue, and app/pages/författare/[author]/titlar/[title]/sida/[page]/[mediatype].vue.","Inspected source-info and reader URN type boundaries in shared/types/reader-source-info.ts, shared/types/reader.ts, app/lib/api/generated/lbapi.ts, server/utils/reader-source-info-validation.ts, and server/utils/reader-source-info-projection.ts.","Inspected named test test/unit/production-shortcuts.spec.ts plus relevant adjacent coverage in test/unit/reader-source-info-dialog.spec.ts, test/ssr/reader.spec.ts, test/e2e/reader.behavior.spec.ts, and test/e2e/reader-production.behavior.spec.ts.","Used read-only inspection commands only; no tests were executed because the review was constrained to read-only commands."]}