{"version":1,"packetId":"app/app.vue::packet::template-1","packetFingerprint":"8dd635a1c3ff8867c59b52e7ec3d54148c06c31b1df8c6232d094ab2235b80a8","author":"implementation-agent","reviewer":"independent-codex-review","method":"codex-read-only","verdict":"approved","findings":[],"verification":["Read quality/semantic-review-contract.md and the specified packet JSON only.","Inspected owned lines 2-5 of app/app.vue.","Inspected direct app shell context: app/layouts/default.vue, app/layouts/reader.vue, nuxt.config.ts.","Inspected relevant local coverage: test/unit/app-shell.spec.ts and test/e2e/shell-accessibility.behavior.spec.ts.","Checked installed Nuxt implementation for NuxtLayout/NuxtRouteAnnouncer/NuxtPage behavior in node_modules/nuxt/dist/pages/runtime/app.vue, node_modules/nuxt/dist/app/components/nuxt-route-announcer.js, and node_modules/nuxt/dist/app/composables/route-announcer.js.","Used read-only commands only; did not run tests because the contract requested read-only commands and test execution may write cache/output files."]}