{"version":1,"packetId":"server/utils/reader-source-info-validation.ts::packet::validSegment","packetFingerprint":"1ebd676e3712329a339b19f036cfb749c17e98a96e7cb158954dbdb8676b0baa","author":"implementation-agent","reviewer":"independent-codex-review","method":"codex-read-only","verdict":"approved","findings":[],"verification":["Read review contract quality/semantic-review-contract.md.","Read packet .quality/semantic-review/packets/da80d0aeeaf4d5a5106998b3d49058afd1c875d6a5dccfe02d235ba145f407db.json.","Inspected owned unit server/utils/reader-source-info-validation.ts lines 104-112 in current source, plus surrounding validation, URL, and request parsing logic.","Inspected direct imports and dependencies: shared/utils/text-safety.ts, app/lib/api/generated/lbapi.ts, app/lib/api/client.ts, server/utils/server-lb-api-client.ts, and relevant h3/openapi-fetch path decoding/encoding behavior in node_modules.","Inspected direct callers named by the packet: server/api/reader/resolve/[author]/[title].get.ts, server/utils/reader-source-info.ts, server/utils/reader-source-info-definitions.ts, server/utils/reader-source-info-projection.ts, server/utils/reader-source-info-sanitizer.ts, and server/utils/work-manifest-validation.ts. Also inspected server/api/reader/source-info/[author]/[title].get.ts found by current-source reference search.","Inspected listed tests test/unit/reader-source-info.spec.ts and test/unit/reader-source-info-facade.spec.ts, including request-boundary and encoded path hazard cases.","Ran rg -n \"validSegment|isSafePathSegment|reader-source-info-validation\" server test app shared and rg -n \"getRouterParam\\(|decode: true|parseReaderSourceInfoRequest\\(\" -S . to verify current callers.","Attempted targeted tests with npx vitest run test/unit/reader-source-info.spec.ts test/unit/reader-source-info-facade.spec.ts --pool forks; startup was blocked by read-only sandbox because Vite attempted to write node_modules/.vite-temp/vitest.config.ts.timestamp-*.mjs. An earlier --runInBand attempt failed because this Vitest version does not support that option."]}