{"version":1,"packetId":"server/utils/reader-source.ts::packet::facsimileSourcePair","packetFingerprint":"d99204675afe26145eaff971b2f798578c8e16818819bb028d0b99500ac59011","author":"implementation-agent","reviewer":"independent-codex-review","method":"codex-read-only","verdict":"approved","findings":[{"id":"d9920467-minor-001","severity":"minor","category":"complexity","path":"server/utils/reader-source.ts","unitId":"server/utils/reader-source.ts::function::facsimileSourcePair","line":205,"summary":"The exported source-pair helper is not used by production code.","consequence":"The Reader keeps a test-only API that can drift from the actual facsimile rendering path, adding maintenance surface without protecting observable behavior.","evidence":"The owned function is exported at line 205, but `rg` finds `facsimileSourcePair` only in this definition and in `test/unit/reader-source.spec.ts`; production facsimile pages build `sources` with `buildFacsimileSources`, and the client computes `selectedSource`/`retinaSource` directly in `ReaderFacsimileImage.vue`.","recommendation":"Delete `facsimileSourcePair` and remove its import/assertion from the unit test, or move this pairing policy into the actual facsimile image consumer if it is meant to be the canonical srcset builder.","status":"unresolved","resolution":null,"resolutionCommit":null,"verification":["Read `quality/semantic-review-contract.md`.","Read exactly the requested packet JSON `.quality/semantic-review/packets/d1b3c0f58b9a623187fa7abd99eaa42c4507c8e90751eef68f3a4ce64a91c205.json`.","Inspected owned physical lines 205-215 in `server/utils/reader-source.ts` with surrounding metadata and Reader source functions.","Inspected packet-listed direct imports and type boundaries: `shared/types/reader.ts`, `shared/types/work-manifest.ts`, `shared/utils/facsimile-source.ts`, `shared/utils/managed-text.ts`, `shared/utils/renderable-html.ts`, and `server/utils/work-manifest-client.ts`.","Inspected direct production facsimile consumers in `server/api/reader/[author]/[title]/[page]/[mediatype].get.ts`, `app/components/reader/ReaderFacsimileImage.vue`, `app/lib/reader-facsimile-page.ts`, and the Reader page focus-size computations.","Inspected packet-listed test `test/unit/reader-source.spec.ts`, including the `facsimileSourcePair` assertion at lines 571-581.","Searched current source with `rg` for `facsimileSourcePair`, facsimile source builders, adjacent-size helpers, and srcset construction, excluding `quality/**` and `.quality/**`.","Attempted read-only `git status --short`; it completed after sandbox-related xcrun cache warnings and showed existing unrelated dirty files.","No tests were executed because the review was constrained to read-only commands."]}],"verification":["Read `quality/semantic-review-contract.md`.","Read exactly the requested packet JSON `.quality/semantic-review/packets/d1b3c0f58b9a623187fa7abd99eaa42c4507c8e90751eef68f3a4ce64a91c205.json`.","Inspected owned physical lines 205-215 in `server/utils/reader-source.ts`.","Inspected the owned function's surrounding source, direct imports, generated/public type boundaries, direct production facsimile consumers, and the packet-listed unit test.","Used read-only `rg`, `nl -ba`, `sed`, `jq`, and `git status --short` inspection commands only.","Did not review or summarize any other packet."]}