{"version":1,"packetId":"server/middleware/presentation-redirect.ts::packet::module-defineEventHandler.callback[1]@a3b5de19be5c#1","packetFingerprint":"f7f3f6013a2e35921aaa40fd92ad5bf50ccb02b33b965f92f9ac099559182fca","author":"implementation-agent","reviewer":"independent-codex-review","method":"codex-read-only","verdict":"approved","findings":[],"verification":["Read quality/semantic-review-contract.md and exactly the specified packet JSON.","Inspected owned unit server/middleware/presentation-redirect.ts lines 8-25 with physical line numbers.","Inspected direct import app/lib/presentation-routes.ts, including fullyDecodedFilename and validatePresentationSegments validation behavior.","Confirmed there are no direct source callers because server/middleware/presentation-redirect.ts is Nuxt-discovered middleware.","Inspected route consumer app/pages/presentationer/[...segments].vue and re-export app/pages/presentationer/presentation-parser.ts for canonical segment validation and content path construction.","Inspected relevant discovered tests test/ssr/presentations.spec.ts, test/unit/presentation-parser.spec.ts, test/unit/managed-html-navigation.spec.ts, and test/unit/internal-navigation.spec.ts for redirect destinations, method gating, unsafe alias rejection, canonical segment validation, and native-browser handling of legacy aliases.","Checked targeted git diff for server/middleware/presentation-redirect.ts, app/lib/presentation-routes.ts, app/pages/presentationer/[...segments].vue, and relevant tests; no scoped source/test diff was present.","Used read-only commands only; no tests were executed because the review request constrained inspection to read-only commands."]}