{"version":1,"packetId":"app/lib/observability/browser.ts::packet::createBrowserErrorEvent","packetFingerprint":"a5a26b62138bd5a3d82372023301267c1dff2074cfe90ea9764799f7b1145112","author":"implementation-agent","reviewer":"independent-codex-review","method":"codex-read-only","verdict":"approved","findings":[],"verification":["Read `quality/semantic-review-contract.md` and exactly one packet JSON: `.quality/semantic-review/packets/fc1dfaef6ed5f04967c95cb7ee3ed020ced0c0a8923b649da0e3af0b1ca524ab.json`.","Inspected owned unit `app/lib/observability/browser.ts::function::createBrowserErrorEvent` at physical lines 215-278.","Inspected direct import/type boundary `app/lib/observability/events.ts` and generated backend event schemas in `app/lib/api/generated/lbapi.ts`.","Inspected direct caller context `app/plugins/observability.client.ts` and broader references to `createBrowserErrorEvent`, `BrowserObservabilityReporter`, and browser observability event names.","Inspected packet-named test file `test/unit/observability-browser.spec.ts` plus related observability contract/intake tests for semantic coverage.","Used read-only inspection commands only; no tests were executed because the review request constrained commands to read-only inspection."]}