{"version":1,"packetId":"server/utils/reader-source-info-validation.ts::packet::exactKeys","packetFingerprint":"8973fb2a1c4e52e62642019f43f44a665a2fdcd9232c16dfce9613adb6b6e0d4","author":"implementation-agent","reviewer":"independent-codex-review","method":"codex-read-only","verdict":"approved","findings":[],"verification":["Read quality/semantic-review-contract.md and the specified packet JSON only.","Inspected owned unit server/utils/reader-source-info-validation.ts lines 48-51 in current source, plus surrounding validation code.","Inspected direct callers in server/utils/reader-source-info.ts, server/utils/reader-source-info-projection.ts, server/utils/work-manifest-validation.ts, and server/api/reader/resolve/[author]/[title].get.ts.","Inspected generated type boundary app/lib/api/generated/lbapi.ts for WorkSourceInfoResponse and nested SourceInfo* schemas.","Inspected listed tests test/unit/reader-source-info.spec.ts and test/unit/reader-source-info-facade.spec.ts.","Attempted pnpm test -- --run test/unit/reader-source-info.spec.ts test/unit/reader-source-info-facade.spec.ts; command did not run because packageManager requires yarn.","Attempted yarn test --run test/unit/reader-source-info.spec.ts test/unit/reader-source-info-facade.spec.ts; blocked by read-only environment because Yarn could not create or use a cache folder.","Attempted ./node_modules/.bin/vitest --run test/unit/reader-source-info.spec.ts test/unit/reader-source-info-facade.spec.ts; blocked by read-only environment because Vite tried to write node_modules/.vite-temp/vitest.config.ts timestamp file."]}