{"version":1,"packetId":"app/lib/reader-dictionary-embed.ts::packet::svenskaReaderEmbedOrigin","packetFingerprint":"ffdab5de989f34207cf294ca93913fc34fc90995b882ee2b0a6cfec210e40eb8","author":"codex-root","reviewer":"independent-codex-review","method":"codex-read-only","verdict":"approved","findings":[{"id":"SR-281f5edc-001","severity":"minor","category":"duplication","path":"app/lib/reader-dictionary-embed.ts","unitId":"app/lib/reader-dictionary-embed.ts::function::svenskaReaderEmbedOrigin","line":46,"summary":"The loopback hostname policy is duplicated between origin validation and the parent-host capability check.","consequence":"If one allowlist changes without the other, local HTTP embed behavior can become inconsistent: the parent may grant the capability while the origin validator rejects it, or the reverse.","evidence":"`svenskaReaderEmbedOrigin` gates local HTTP origins through `localHosts.has(url.hostname)` here, while `useReaderDictionaryEmbed.ts` has a separate `localParentHosts` set for the same localhost, 127.0.0.1, and [::1] policy before passing `allowLocalHttp`.","recommendation":"Move the loopback hostname predicate to one shared helper used by both the parent-host check and this origin validator, keeping the explicit `allowLocalHttp` option as the capability boundary.","status":"unresolved","resolution":null,"resolutionCommit":null,"verification":["Inspected owned physical lines app/lib/reader-dictionary-embed.ts:36-52.","Inspected direct callers app/components/reader/ReaderDictionaryLookup.vue and app/composables/useReaderDictionaryEmbed.ts.","Inspected direct dependencies in app/lib/reader-dictionary-embed.ts and shared/utils/text-safety.ts.","Inspected packet-listed test test/unit/reader-dictionary-embed.spec.ts and related lifecycle coverage in test/unit/reader-dictionary-embed-lifecycle.spec.ts.","Searched current source for svenskaReaderEmbedOrigin, buildReaderDictionaryEmbedUrl, buildSvenskaDictionaryUrl, readerDictionaryMode, and runtime config references."]}],"verification":["Read quality/semantic-review-contract.md.","Read exactly one packet JSON: .quality/semantic-review/packets/281f5edcd6c2e5055f9138489ec8e5f432dfb1593601208e1a59496d1c05fd84.json.","Inspected current source for the owned unit, direct callers, dependencies, runtime configuration, and relevant tests named by the packet.","Ran read-only inspection commands only: sed, nl, rg, jq, git status, and a node URL probe.","Confirmed the only cited finding line is within the owned unit physical range 36-52.","No tests were executed because the sandbox is read-only and the relevant Vitest/Vite commands can write cache or artifact files."]}