{"version":1,"packetId":"app/lib/library/route-state.ts::packet::canonicalLibraryNarrowingKeywords","packetFingerprint":"8d2af2a78d66610950c21a18811fee86dca9b9ff06bacd8b630671e2720d13b8","author":"implementation-agent","reviewer":"independent-codex-review","method":"codex-read-only","verdict":"approved","findings":[],"verification":["Read quality/semantic-review-contract.md and the packet JSON for the exact review scope.","Inspected owned lines 58-64 in app/lib/library/route-state.ts, including direct imports app/lib/library/component-models.ts, app/lib/library/filter-options.ts, and app/lib/library/navigation.ts.","Inspected direct caller app/pages/bibliotek.vue around parsing, request mapping, reset behavior, route synchronization, and keyword commit paths.","Inspected backend request type boundary in app/lib/library/index.ts for narrowingCategories to narrowing_categories preservation.","Inspected relevant tests in test/unit/library-route-state.spec.ts, plus e2e and SSR coverage for keywords_aux behavior in test/e2e/library-advanced.behavior.spec.ts and test/ssr/library.spec.ts.","Ran read-only rg/git diff inspection commands; no source diff was present for app/lib/library/route-state.ts, app/pages/bibliotek.vue, or test/unit/library-route-state.spec.ts. Tests were not executed because the request limited review to read-only commands."]}