{"version":1,"packetId":"app/lib/reader-facsimile-page.ts::packet::fetchFacsimileOcr","packetFingerprint":"903696b775fc1d849f994f2da47c67177c9a09a2b66f8f662f8a842e014b5dd2","author":"implementation-agent","reviewer":"independent-codex-review","method":"codex-read-only","verdict":"approved","findings":[],"verification":["Read quality/semantic-review-contract.md.","Read packet .quality/semantic-review/packets/052a6b7bccbc16ea1d5a5e6716382ae77bedc34f91d97c8ced3dbd967cf3e3e4.json.","Inspected owned unit app/lib/reader-facsimile-page.ts lines 82-102 and adjacent module context.","Inspected direct caller app/pages/författare/[author]/titlar/[title]/sida/[page]/[mediatype].vue, especially facsimile OCR cache and abort flow around lines 665-738.","Inspected dependencies and type boundaries in shared/utils/facsimile-source.ts, shared/utils/managed-text.ts, shared/utils/reader-ocr.ts, shared/types/reader.ts, server/utils/reader-ocr.ts, and server/api/reader/[author]/[title]/[page]/[mediatype].get.ts.","Packet listed no tests; inspected relevant existing OCR/facsimile tests in test/unit/reader-final-parity.spec.ts, test/e2e/reader-final-parity.behavior.spec.ts, test/e2e/reader.behavior.spec.ts, and test/ssr/reader-final-parity.spec.ts.","No repository modifications were made."]}