{"version":1,"packetId":"server/utils/sla-article.ts::packet::slaArticleError","packetFingerprint":"fd84904da2e4a2cc19df18b134d8023a5f90076405d0abc708e61e22b7b4e5a9","author":"implementation-agent","reviewer":"independent-codex-review","method":"codex-read-only","verdict":"approved","findings":[],"verification":["Read review contract at quality/semantic-review-contract.md.","Read packet .quality/semantic-review/packets/6a424e59b0fda2644f410a0278fc359332b1736589d278dec18e5508988c5bda.json.","Inspected owned unit server/utils/sla-article.ts lines 461-470 and surrounding module context lines 1-566.","Inspected direct caller server/api/author-documents/[author]/[document]/[article].get.ts lines 1-58.","Inspected listed test test/unit/sla-article.spec.ts lines 1-510.","Inspected shared/types/sla-article.ts lines 1-61, shared/types/renderable-html.ts lines 1-52, shared/utils/renderable-html.ts lines 1-80, and generated type boundary app/lib/api/generated/lbapi.ts lines 2901-2933 and 3903-3919.","Searched usages with rg for slaArticleError, loadSlaArticle, SlaArticle, createError, and local SLA article error codes across server, app, shared, and test paths.","Compared adjacent helper conventions in server/utils/author-document.ts lines 400-408 and server/utils/dramawebben-document.ts lines 169-177.","Attempted npx vitest run test/unit/sla-article.spec.ts, but the read-only sandbox blocked Vite config temp-file creation with EPERM under node_modules/.vite-temp."]}