{"version":1,"packetId":"shared/utils/managed-text.ts::packet::fetchManagedText","packetFingerprint":"c16c9bd988e63755f652942f2e9b540b2b89f6b188991cd737e2221ac7b22a67","author":"implementation-agent","reviewer":"independent-codex-review","method":"codex-read-only","verdict":"approved","findings":[],"verification":["Read review contract at quality/semantic-review-contract.md.","Read packet .quality/semantic-review/packets/90744c8d3948bdf24b607a189026ddf67e4be1c37907c18e3ef86330151327b2.json.","Inspected owned unit shared/utils/managed-text.ts lines 373-423 and surrounding helpers/imports in shared/utils/managed-text.ts.","Inspected packet import shared/about-pages.ts.","Inspected direct callers server/utils/reader-ocr.ts and server/utils/reader-source.ts, plus current additional imports found via rg in server/api/about/[page].get.ts, app/pages/index.vue, and app/pages/presentationer/[...segments].vue.","Inspected relevant tests named by the packet: test/unit/about-content-fixtures.spec.ts, test/unit/home-content-fixtures.spec.ts, test/unit/managed-text.spec.ts, and test/unit/presentation-content-fixtures.spec.ts.","Used read-only commands only; did not execute test suites because the review request constrained commands to read-only inspection."]}