{"version":1,"packetId":"app/components/library/LibraryAuthorResults.vue::packet::component","packetFingerprint":"3658095f686fd8da10bd62296117340dd42bf0f72a4cfdabdafe1b454ca1dc57","author":"implementation-agent","reviewer":"independent-codex-review","method":"codex-read-only","verdict":"approved","findings":[],"verification":["Read quality/semantic-review-contract.md and the specified packet JSON.","Inspected owned component app/components/library/LibraryAuthorResults.vue with physical line numbers.","Inspected direct imports app/lib/internal-navigation.ts, app/lib/library/component-models.ts, app/lib/library/navigation.ts, and app/lib/library/page-results.ts.","Inspected response type source app/lib/library/view-model.ts for authors-mode shape and mapping.","Searched current source and tests for LibraryAuthorResults, data-library-author-row, data-library-authors-show-all, selectSort, showAll, and AuthorBrowseResponse usages.","Inspected direct caller wiring in app/pages/bibliotek.vue for author sort options, sort direction, show-all loading, and event handlers.","Inspected relevant coverage in test/unit/library-component-boundaries.spec.ts and test/e2e/library.behavior.spec.ts."]}