{"version":1,"packetId":"app/lib/library/route-state.ts::packet::parseLibraryYearRange","packetFingerprint":"5d00deb8dd638874b14c8d559a6e3c19fee8f09bd2e27043a2a90b7b9074b186","author":"implementation-agent","reviewer":"independent-codex-review","method":"codex-read-only","verdict":"approved","findings":[],"verification":["Read quality/semantic-review-contract.md and the exact current packet JSON.","Inspected parseLibraryYearRange, chronology authority loading, direct Library page route-state use, chronology draft/reset/commit callers, and focused route-state, SSR, and browser tests.","Confirmed the singular interval parameter intentionally remains scalar-only and fails closed for repeated LocationQuery arrays; it accepts only exact four-digit from,to values within live bounds and ordered from<=to, while representing the full available range as no filter.","Confirmed the repeated-list fix in immutable commit a4085062667eaf7b3c35ab7c8aa2e95bec7c71bd does not broaden or otherwise alter year-range semantics.","Fresh Node 22 verification: test/unit/library-route-state.spec.ts 16/16; targeted Library SSR 1/1; targeted desktop Chromium 1/1; scoped ESLint passed."]}