{"version":1,"packetId":"shared/utils/renderable-html.ts::packet::emptyRenderableHtml","packetFingerprint":"f4e982ecedb4bffeb90e1254c133ae68c1a304701fd93ee6423b984df86e5d00","author":"implementation-agent","reviewer":"independent-codex-review","method":"codex-read-only","verdict":"approved","findings":[],"verification":["Read quality/semantic-review-contract.md.","Read exactly one packet JSON: .quality/semantic-review/packets/0b09c7c6a7334cd85681c27ba73bbe9077471a44a01bc6fd5894321a57cef3ee.json.","Inspected owned unit shared/utils/renderable-html.ts:76-78 and surrounding issuer helpers.","Inspected imported type boundary shared/types/renderable-html.ts, including RenderableHtml and RenderableCapability brands.","Inspected packet-listed callers in server/utils/author-document.ts, server/utils/dramawebben-document.ts, server/utils/editor-reader-html.ts, server/utils/reader-ocr.ts, server/utils/reader-source-info-sanitizer.ts, server/utils/reader-source.ts, and server/utils/sla-article.ts.","Searched current references with rg and inspected additional direct callers using emptyRenderableHtml in app/pages/presentationer/presentation-parser.ts, app/pages/författare/[author]/titlar/[title]/sida/[page]/[mediatype].vue, app/pages/om/[page].vue, app/components/reader/ReaderDictionaryLookup.vue, app/components/reader/ReaderSourceInfoDialog.vue, app/lib/home-content.ts, app/lib/author-profile.ts, and app/lib/reader-dictionary.ts.","Inspected relevant render boundary app/components/global/RenderableHtmlContent.vue.","Inspected packet-listed tests test/nuxt/renderable-html-contract.ts, test/unit/reader-source.spec.ts, and test/unit/search-hit-highlight.spec.ts.","Ran ./node_modules/.bin/vue-tsc --noEmit --pretty false --project tsconfig.json successfully.","Ran node scripts/verify-architecture-policy.mjs successfully.","Attempted yarn vitest run test/unit/reader-source.spec.ts test/unit/search-hit-highlight.spec.ts, but Yarn could not find a writable cache folder in the read-only environment.","Attempted ./node_modules/.bin/vitest run test/unit/reader-source.spec.ts test/unit/search-hit-highlight.spec.ts, but Vite config loading attempted to write node_modules/.vite-temp and failed with EPERM under the read-only environment."]}