{"version":1,"packetId":"app/composables/useManagedHtmlNavigation.ts::packet::useManagedHtmlNavigation","packetFingerprint":"8b60ab0587869d94bd813b64a0c76f006712b8e300c6c82ad66b97a5190815b2","author":"implementation-agent","reviewer":"independent-codex-review","method":"codex-read-only","verdict":"approved","findings":[],"verification":["Read quality/semantic-review-contract.md and exactly the specified packet JSON.","Inspected owned source app/composables/useManagedHtmlNavigation.ts lines 3-26 with physical line numbers.","Inspected direct dependency app/lib/managed-html-navigation.ts and route classification dependency app/lib/internal-navigation.ts.","Inspected direct render boundary app/components/global/RenderableHtmlContent.vue and current callers in app/pages/index.vue, app/pages/författare/[author]/[document]/[article].vue, app/pages/författare/[author]/[document]/index.vue, app/pages/om/[page].vue, and app/pages/presentationer/[...segments].vue.","Inspected relevant coverage discoverable from the packet and callers: test/unit/managed-html-navigation.spec.ts, test/e2e/home-page.behavior.spec.ts, test/e2e/about-pages.behavior.spec.ts, test/e2e/author-document-navigation.behavior.spec.ts, and test/e2e/presentations.behavior.spec.ts.","Checked current git status and diff for reviewed source and direct dependencies using read-only commands; no diff was present for app/composables/useManagedHtmlNavigation.ts, app/lib/managed-html-navigation.ts, app/components/global/RenderableHtmlContent.vue, or test/unit/managed-html-navigation.spec.ts.","Used read-only commands only; no tests were executed because the request constrained the review to read-only inspection."]}