{"version":1,"packetId":"app/lib/author-works.ts::packet::hasAuthorWorksAboutContent","packetFingerprint":"d9bcee30bdd67cb40d3d19efff95af98e7f2660aa43f2ca221b28ddfab59b6bf","author":"implementation-agent","reviewer":"independent-codex-review","method":"codex-read-only","verdict":"approved","findings":[],"verification":["Read review contract at quality/semantic-review-contract.md.","Read packet .quality/semantic-review/packets/31b39abfc3f6888b5b239d8f72e428f027741546c77075f6990614a41c33491b.json.","Inspected owned lines 404-406 in app/lib/author-works.ts, including callback on line 405.","Inspected direct imports app/lib/author-profile.ts and app/lib/internal-navigation.ts.","Inspected direct callers app/components/author/AuthorWorksContent.vue, app/pages/författare/[author]/mer.vue, and app/pages/författare/[author]/titlar/index.vue.","Inspected generated type boundary app/lib/api/generated/lbapi.ts#components AuthorWorksResponse and AuthorWorkSection.","Inspected listed tests test/unit/author-works.spec.ts, test/ssr/author-works.spec.ts, and test/ssr/author-works-export-proxy.spec.ts.","Searched app and test for hasAuthorWorksAboutContent and about_sections usages with rg.","Attempted ./node_modules/.bin/vitest run test/unit/author-works.spec.ts, but the read-only sandbox blocked Vite config temp-file creation under node_modules/.vite-temp with EPERM.","Attempted yarn vitest run test/unit/author-works.spec.ts, but Yarn could not find a writable cache folder under the read-only sandbox."]}