{"version":1,"packetId":"app/pages/författare/[author]/titlar/[title]/sida/[page]/[mediatype].vue::packet::component","packetFingerprint":"cc9dba6f91434a315e1c749eb895752207e6539e068842c9c86b722f4ef72924","author":"implementation-agent","reviewer":"independent-codex-review","method":"codex-read-only","verdict":"approved","findings":[],"verification":["Read quality/semantic-review-contract.md and the specified packet JSON only.","Inspected the owned component app/pages/författare/[author]/titlar/[title]/sida/[page]/[mediatype].vue with physical line numbers across the packet-owned ranges.","Inspected direct imports and dependencies: app/composables/useLbApiClient.ts, app/lib/reader-routes.ts, app/lib/reader/work-search.ts, app/lib/text-search-navigation.ts, app/lib/search-hit-highlight.ts, app/lib/reader-keyboard-navigation.ts, and generated API type boundaries in app/lib/api/generated/lbapi.ts.","Checked direct references/callers with rg for reader route helpers, storage keys, hooks, teleported controls, and reader UI components.","Reviewed relevant existing tests discovered in test/e2e/reader.behavior.spec.ts and test/ssr/reader.spec.ts for search navigation, stale request cancellation, storage failure handling, SSR rendering, and error boundaries."]}