{"version":1,"packetId":"server/middleware/legacy-author-route.ts::packet::module-rawRequestUrl","packetFingerprint":"d4935d729ebd6be5432f40b9f0d4cdeabe1139a67c05fa63ca86fb328205bbcb","author":"implementation-agent","reviewer":"independent-codex-review","method":"codex-read-only","verdict":"approved","findings":[],"verification":["Read quality/semantic-review-contract.md and the exact requested packet JSON .quality/semantic-review/packets/30a850e549931fc325474e4d41562e154caf5ebb4cf43843b9b8bba78a0ae8e4.json.","Inspected owned physical lines 16-18, 20-22, 24-28, and 30-56 in server/middleware/legacy-author-route.ts.","Inspected direct dependencies server/utils/legacy-author-route.ts and server/utils/author-document.ts, including path decoding, identity normalization, resolver response validation, and RFC3986 segment encoding.","Confirmed there are no source callers because server/middleware/legacy-author-route.ts is Nuxt-discovered middleware; compared adjacent middleware pattern in server/middleware/legacy-dramawebben-route.ts.","Inspected generated API type boundary app/lib/api/generated/lbapi.ts for /legacy-author-routes/resolve, LegacyAuthorRouteRequest, and LegacyAuthorRouteResolution.","Inspected relevant discovered tests test/unit/legacy-author-route.spec.ts and test/ssr/legacy-author-routes.spec.ts; the packet itself listed no tests.","Inspected test fixture behavior for the private legacy author route resolver in test/fixtures/v2-server.mjs.","Checked h3 sendRedirect implementation in node_modules/h3/dist/index.mjs for redirect header/body behavior.","Used read-only rg, sed, nl, and git status/diff inspection commands only; no repository files were modified."]}